{
  "snapshot_id": "src-1684fd7b-b868c7cd06e0",
  "campaign_id": "C-45488bdaf5",
  "created_at": "2026-09-09T12:00:35.000000+00:00",
  "pass": 1,
  "pinned": true,
  "source": {
    "ladder": "git-dirty",
    "git_commit": "1684fd7ba693f9d3a6d3e3953ba0b46120196ad9",
    "git_dirty": true,
    "content_hash": "b868c7cd06e00cc5629cc7354308457749351bae1b9b497e02e3faedd799190f",
    "root": "/home/xand/Projects/dsh-plugins/websec2/web3sec-go/.scratch/verify-p1/pyroot/campaigns/C-45488bdaf5/snapshots/src-1684fd7b-b868c7cd06e0",
    "file_count": 1
  },
  "deployment": null,
  "chain": null,
  "config": null,
  "manifest": {
    "source_merkle_root": "b868c7cd06e00cc5629cc7354308457749351bae1b9b497e02e3faedd799190f",
    "deployment_merkle_root": null,
    "chain_fingerprint": null,
    "toolchain_fingerprint": null,
    "dependency_lock_hash": null,
    "environment_hash": "19cfd372ea653cdc96595ba3339e12b16d5c25e6ba21079af998622c42bf159a",
    "manifest_hash": "a6f7f40c65fe9095b31f87fa668c9c36a23afb9a4f12576d4d4ddf757f560648"
  }
}
